

================================================================
== Vitis HLS Report for 'quad_frame_remapper_Pipeline_2'
================================================================
* Date:           Wed Feb 25 19:26:52 2026

* Version:        2025.1 (Build 6135595 on May 21 2025)
* Project:        hls_component
* Solution:       hls (Vivado IP Flow Target)
* Product family: zynq
* Target device:  xc7z020-clg400-1


================================================================
== Performance Estimates
================================================================
+ Timing: 
    * Summary: 
    +--------+----------+----------+------------+
    |  Clock |  Target  | Estimated| Uncertainty|
    +--------+----------+----------+------------+
    |ap_clk  |  10.00 ns|  7.300 ns|     2.70 ns|
    +--------+----------+----------+------------+

+ Latency: 
    * Summary: 
    +---------+---------+----------+----------+-----+-----+------------------------------------------------+
    |  Latency (cycles) |  Latency (absolute) |  Interval |                    Pipeline                    |
    |   min   |   max   |    min   |    max   | min | max |                      Type                      |
    +---------+---------+----------+----------+-----+-----+------------------------------------------------+
    |      363|      363|  3.630 us|  3.630 us|  361|  361|  loop auto-rewind stp (delay=0 clock cycles(s))|
    +---------+---------+----------+----------+-----+-----+------------------------------------------------+

    + Detail: 
        * Instance: 
        N/A

        * Loop: 
        +----------+---------+---------+----------+-----------+-----------+------+----------+
        |          |  Latency (cycles) | Iteration|  Initiation Interval  | Trip |          |
        | Loop Name|   min   |   max   |  Latency |  achieved |   target  | Count| Pipelined|
        +----------+---------+---------+----------+-----------+-----------+------+----------+
        |- Loop 1  |      361|      361|         3|          1|          1|   360|       yes|
        +----------+---------+---------+----------+-----------+-----------+------+----------+

============================================================
+ Verbose Summary: Synthesis Manager
============================================================
InlineROM: 1
ExposeGlobal: 0
============================================================
+ Verbose Summary: CDFG Model
============================================================
IsTopModel: 0
ResetActiveHigh: 1
IsCombinational: 0
IsDatapathOnly: 0
HasWiredReturn: 1
HasMFsm: 2
HasVarLatency: 1
IsPipeline: 0
IsRtlPipelined: 0
IsInstanceOverlapped: 0
IsDontTouch: 0
HasImplIP: 0
IsGatedGlobalClock: 0

+ Individual pipeline summary: 
  * Pipeline-0: initiation interval (II) = 1, depth = 3


============================================================
+ Verbose Summary: Schedule
============================================================
* Number of FSM states : 3
* Pipeline : 1
  Pipeline-0 : II = 1, D = 3, States = { 1 2 3 }
* Dataflow Pipeline: 0

* FSM state transitions: 
1 --> 2 
2 --> 3 
3 --> 

* FSM state operations: 

State 1 <SV = 0> <Delay = 4.99>
ST_1 : Operation 6 [1/1] (0.00ns)   --->   "%loop_index8 = alloca i32 1"   --->   Operation 6 'alloca' 'loop_index8' <Predicate = true> <Delay = 0.00>
ST_1 : Operation 7 [1/1] (0.00ns)   --->   "%specbramwithbyteenable_ln0 = specbramwithbyteenable void @_ssdm_op_SpecBRAMWithByteEnable, i128 %line_buf_out"   --->   Operation 7 'specbramwithbyteenable' 'specbramwithbyteenable_ln0' <Predicate = true> <Delay = 0.00>
ST_1 : Operation 8 [1/1] (0.00ns)   --->   "%sext_ln107_read = read i60 @_ssdm_op_Read.ap_auto.i60, i60 %sext_ln107"   --->   Operation 8 'read' 'sext_ln107_read' <Predicate = true> <Delay = 0.00>
ST_1 : Operation 9 [1/1] (0.00ns)   --->   "%sext_ln107_cast = sext i60 %sext_ln107_read"   --->   Operation 9 'sext' 'sext_ln107_cast' <Predicate = true> <Delay = 0.00>
ST_1 : Operation 10 [1/1] (0.00ns)   --->   "%specinterface_ln0 = specinterface void @_ssdm_op_SpecInterface, i128 %gmem1, void @empty, i32 0, i32 0, void @empty_0, i32 0, i32 388800, void @empty_3, void @empty_2, void @empty_0, i32 16, i32 2, i32 16, i32 32, void @empty_0, void @empty_0, i32 4294967295, i32 0, i32 0"   --->   Operation 10 'specinterface' 'specinterface_ln0' <Predicate = true> <Delay = 0.00>
ST_1 : Operation 11 [1/1] (1.58ns)   --->   "%store_ln0 = store i9 0, i9 %loop_index8"   --->   Operation 11 'store' 'store_ln0' <Predicate = true> <Delay = 1.58>
ST_1 : Operation 12 [1/1] (0.00ns)   --->   "%br_ln0 = br void %load-store-loop7"   --->   Operation 12 'br' 'br_ln0' <Predicate = true> <Delay = 0.00>
ST_1 : Operation 13 [1/1] (0.00ns)   --->   "%loop_index8_load = load i9 %loop_index8"   --->   Operation 13 'load' 'loop_index8_load' <Predicate = true> <Delay = 0.00>
ST_1 : Operation 14 [1/1] (0.00ns)   --->   "%specbitsmap_ln0 = specbitsmap void @_ssdm_op_SpecBitsMap, i128 %gmem1"   --->   Operation 14 'specbitsmap' 'specbitsmap_ln0' <Predicate = true> <Delay = 0.00>
ST_1 : Operation 15 [1/1] (1.82ns)   --->   "%exitcond2915 = icmp_eq  i9 %loop_index8_load, i9 360"   --->   Operation 15 'icmp' 'exitcond2915' <Predicate = true> <Delay = 1.82> <CoreInst = "Cmp">   --->   Core 9 'Cmp' <Latency = 0> <II = 1> <Delay = 1.82> <FuncUnit> <Opcode : 'seteq' 'setne' 'setle' 'setge' 'setlt' 'setgt'> <InPorts = 2> <OutPorts = 1>
ST_1 : Operation 16 [1/1] (1.82ns)   --->   "%empty = add i9 %loop_index8_load, i9 1"   --->   Operation 16 'add' 'empty' <Predicate = true> <Delay = 1.82> <CoreInst = "Adder">   --->   Core 1 'Adder' <Latency = 0> <II = 1> <Delay = 1.82> <FuncUnit> <Opcode : 'add' 'sub'> <InPorts = 2> <OutPorts = 1>
ST_1 : Operation 17 [1/1] (0.00ns)   --->   "%br_ln0 = br i1 %exitcond2915, void %load-store-loop7.split, void %cleanup.loopexit.exitStub"   --->   Operation 17 'br' 'br_ln0' <Predicate = true> <Delay = 0.00>
ST_1 : Operation 18 [1/1] (0.00ns)   --->   "%loop_index8_cast = zext i9 %loop_index8_load"   --->   Operation 18 'zext' 'loop_index8_cast' <Predicate = (!exitcond2915)> <Delay = 0.00>
ST_1 : Operation 19 [1/1] (0.00ns)   --->   "%line_buf_out_addr_1 = getelementptr i128 %line_buf_out, i64 0, i64 %loop_index8_cast"   --->   Operation 19 'getelementptr' 'line_buf_out_addr_1' <Predicate = (!exitcond2915)> <Delay = 0.00>
ST_1 : Operation 20 [2/2] (3.25ns)   --->   "%line_buf_out_load = load i9 %line_buf_out_addr_1"   --->   Operation 20 'load' 'line_buf_out_load' <Predicate = (!exitcond2915)> <Delay = 3.25> <CoreInst = "RAM">   --->   Core 81 'RAM' <Latency = 1> <II = 1> <Delay = 3.25> <Storage> <Opcode : 'load' 'store'> <Ports = 2> <Width = 128> <Depth = 360> <RAM>
ST_1 : Operation 21 [1/1] (1.58ns)   --->   "%store_ln0 = store i9 %empty, i9 %loop_index8"   --->   Operation 21 'store' 'store_ln0' <Predicate = (!exitcond2915)> <Delay = 1.58>

State 2 <SV = 1> <Delay = 3.25>
ST_2 : Operation 22 [1/2] ( I:3.25ns O:3.25ns )   --->   "%line_buf_out_load = load i9 %line_buf_out_addr_1"   --->   Operation 22 'load' 'line_buf_out_load' <Predicate = true> <Delay = 3.25> <CoreInst = "RAM">   --->   Core 81 'RAM' <Latency = 1> <II = 1> <Delay = 3.25> <Storage> <Opcode : 'load' 'store'> <Ports = 2> <Width = 128> <Depth = 360> <RAM>
ST_2 : Operation 28 [1/1] (1.58ns)   --->   "%ret_ln0 = ret"   --->   Operation 28 'ret' 'ret_ln0' <Predicate = (exitcond2915)> <Delay = 1.58>

State 3 <SV = 2> <Delay = 7.30>
ST_3 : Operation 23 [1/1] (0.00ns)   --->   "%gmem1_addr = getelementptr i128 %gmem1, i64 %sext_ln107_cast" [C:/quad_frame_remapper/quad_frame_remapper.cpp:107]   --->   Operation 23 'getelementptr' 'gmem1_addr' <Predicate = true> <Delay = 0.00>
ST_3 : Operation 24 [1/1] (0.00ns)   --->   "%specpipeline_ln0 = specpipeline void @_ssdm_op_SpecPipeline, i32 4294967295, i32 0, i32 0, i32 0, void @empty_0"   --->   Operation 24 'specpipeline' 'specpipeline_ln0' <Predicate = true> <Delay = 0.00>
ST_3 : Operation 25 [1/1] (0.00ns)   --->   "%speclooptripcount_ln0 = speclooptripcount void @_ssdm_op_SpecLoopTripCount, i64 360, i64 360, i64 360"   --->   Operation 25 'speclooptripcount' 'speclooptripcount_ln0' <Predicate = true> <Delay = 0.00>
ST_3 : Operation 26 [1/1] (7.30ns)   --->   "%write_ln107 = write void @_ssdm_op_Write.m_axi.p1i128, i128 %gmem1_addr, i128 %line_buf_out_load, i16 65535" [C:/quad_frame_remapper/quad_frame_remapper.cpp:107]   --->   Operation 26 'write' 'write_ln107' <Predicate = true> <Delay = 7.30> <CoreInst = "m_axi">   --->   Core 111 'm_axi' <Latency = 5> <II = 1> <Delay = 1.00> <Adapter> <Opcode : 'read' 'write' 'readreq' 'writereq' 'writeresp'>
ST_3 : Operation 27 [1/1] (0.00ns)   --->   "%br_ln0 = br void %load-store-loop7"   --->   Operation 27 'br' 'br_ln0' <Predicate = true> <Delay = 0.00>


============================================================
+ Verbose Summary: Timing violations
============================================================
Target clock period: 10.000ns, clock uncertainty: 2.700ns.

 <State 1>: 4.999ns
The critical path consists of the following:
	'store' operation 0 bit ('store_ln0') of constant 0 on local variable 'loop_index8' [9]  (1.588 ns)
	'load' operation 9 bit ('loop_index8_load') on local variable 'loop_index8' [12]  (0.000 ns)
	'icmp' operation 1 bit ('exitcond2915') [14]  (1.823 ns)
	'store' operation 0 bit ('store_ln0') of variable 'empty' on local variable 'loop_index8' [25]  (1.588 ns)

 <State 2>: 3.254ns
The critical path consists of the following:
	'load' operation 128 bit ('line_buf_out_load') on array 'line_buf_out' [23]  (3.254 ns)

 <State 3>: 7.300ns
The critical path consists of the following:
	'getelementptr' operation 128 bit ('gmem1_addr', C:/quad_frame_remapper/quad_frame_remapper.cpp:107) [18]  (0.000 ns)
	bus write operation ('write_ln107', C:/quad_frame_remapper/quad_frame_remapper.cpp:107) on port 'gmem1' (C:/quad_frame_remapper/quad_frame_remapper.cpp:107) [24]  (7.300 ns)


============================================================
+ Verbose Summary: Binding
============================================================
N/A
* FSMD analyzer results:
  - Output states:
 - Input state : 
  - Chain level:
	State 1
	State 2
	State 3


============================================================
+ Verbose Summary: Datapath Resource usage 
============================================================
N/A
